{
  "schema": "brunnr-code.review-integration.capabilities/v2.2",
  "contract": "brunnr-code.review-integration/v2",
  "protocol": {"major": 2, "minor": 2},
  "package": {"name": "brunnr-code", "version": "2.1.7-test", "release_channel": "prerelease"},
  "build": {
    "id": "sha256:d6f2251b654672005f22c20d2f35b146c6b1c1fe129d294444baa32d6a829664",
    "go_version": "go1.25.10",
    "module_version": "v2.1.7",
    "vcs": "git",
    "vcs_revision": "0123456789abcdef0123456789abcdef01234567",
    "vcs_time": "2026-07-15T18:00:00Z",
    "vcs_modified": "false"
  },
  "executable": {
    "sha256": "sha256:0fe0ce5cdd881d7446c03d16f308d2646a7eafde1a51db97a58b689d112bb248",
    "evidence": "self-reported",
    "verification": "compare-with-published-manifest"
  },
  "operations": [
    "review.capabilities", "review.repair", "review.start", "review.status", "review.validate"
  ],
  "gates": ["post-apply", "pre-commit", "pre-push", "pre-pr", "release"],
  "projections": ["staged", "workspace"],
  "schemas": [
    "brunnr-code.review-admitted-result/v2",
    "brunnr-code.review-artifact-subject/v2",
    "brunnr-code.review-authority-repair-assessment/v1",
    "brunnr-code.review-authority-status/v1",
    "brunnr-code.review-gate-request/v1",
    "brunnr-code.review-integration.capabilities/v2.2",
    "brunnr-code.review-integration.failure/v2",
    "brunnr-code.review-integration.operation/v2",
    "brunnr-code.review-integration.projection/v1",
    "brunnr-code.review-integration.repair/v2",
    "brunnr-code.review-integration.start/v3",
    "brunnr-code.review-integration.status/v5",
    "brunnr-code.review-receipt/v1",
    "brunnr-code.review-result-artifact/v2",
    "brunnr-code.review-targeted-validation-request/v1",
    "https://github.com/carsimax/brunnr-code/schema/review/refuter/v1",
    "https://github.com/carsimax/brunnr-code/schema/review/reviewer/v1",
    "https://github.com/carsimax/brunnr-code/schema/review/validator/v1",
    "brunnr-code.review-integration.consent/v3"
  ],
  "features": {
    "mandatory": [
      {"name": "compact_v2_authority", "supported": true, "requires": []},
      {"name": "immutable_snapshot", "supported": true, "requires": []},
      {"name": "legacy_v1_target_scoped_read_only", "supported": true, "requires": ["target_scoped_status"]},
      {"name": "repository_independent_capabilities", "supported": true, "requires": []},
      {"name": "restart_safe_projection", "supported": true, "requires": ["target_scoped_status"]},
      {"name": "target_scoped_status", "supported": true, "requires": ["repository_independent_capabilities"]},
      {"name": "uniform_failure_envelope", "supported": true, "requires": ["repository_independent_capabilities"]}
    ],
    "optional": [
      {"name": "base_ref_workspace_overlay", "supported": true, "requires": ["immutable_snapshot", "restart_safe_projection"]},
      {"name": "bounded_process_waits", "supported": true, "requires": ["uniform_failure_envelope"]},
      {"name": "classified_authority_repair", "supported": true, "requires": ["native_next_transition", "uniform_failure_envelope"]},
      {"name": "native_frozen_candidate_context", "supported": true, "requires": ["immutable_snapshot"]},
      {"name": "native_low_risk_verification", "supported": true, "requires": ["compact_v2_authority"]},
      {"name": "native_next_transition", "supported": true, "requires": ["target_scoped_status"]},
      {"name": "opaque_repository_context", "supported": true, "requires": ["compact_v2_authority", "native_next_transition"]},
      {"name": "provider_artifact_admission", "supported": true, "requires": ["compact_v2_authority", "native_frozen_candidate_context", "opaque_repository_context"]},
      {"name": "provider_targeted_validation_request", "supported": true, "requires": ["compact_v2_authority", "native_next_transition"]},
      {"name": "recovered_correction_evidence", "supported": true, "requires": ["compact_v2_authority", "provider_targeted_validation_request"]},
      {"name": "risk_reasons", "supported": true, "requires": ["repository_independent_capabilities"]},
      {"name": "scope_change_diagnostics", "supported": true, "requires": ["uniform_failure_envelope"]},
      {"name": "validating_result_reopen", "supported": true, "requires": ["compact_v2_authority", "provider_artifact_admission"]},
      {"name": "provider_bound_native_git_context", "supported": true, "requires": ["native_frozen_candidate_context", "opaque_repository_context", "provider_artifact_admission"]},
      {"name": "provider_submission_descriptors", "supported": true, "requires": ["native_next_transition", "opaque_repository_context", "provider_targeted_validation_request"]}
    ]
  },
  "bootstrap": {
    "command": "brunnr-code review status --cwd \u003crepo\u003e --contract brunnr-code.review-integration/v2 --next-transition",
    "target_selector_variants": [
      {"target_type": "staged", "arguments": ["--projection", "staged"]},
      {"target_type": "base_ref", "arguments": ["--base-ref", "\u003cref\u003e"]},
      {"target_type": "workspace_overlay_base_ref", "arguments": ["--workspace-overlay", "--base-ref", "\u003cref\u003e"]},
      {"target_type": "workspace_overlay_base_tree", "arguments": ["--workspace-overlay", "--base-tree", "\u003ctree\u003e"]}
    ],
    "required_feature": "native_next_transition",
    "unsupported_outcome": "unsupported-capability",
    "parent_only": true
  },
  "compatibility": {
    "minimum_protocol_major": 2,
    "maximum_protocol_major": 2,
    "additive_minor_policy": "optional-fields-only",
    "unknown_mandatory": "reject",
    "unknown_optional": "ignore",
    "modes": ["compact-v2", "legacy-v1"],
    "legacy_window": {
      "mode": "legacy-v1",
      "state": "active",
      "read_only": true,
      "deprecation_started": true,
      "removal": "not-scheduled",
      "minimum_compatibility_releases": 1
    }
  }
}
